{
  "artifact_execution": false,
  "backend_code_executed": false,
  "backend_code_included": false,
  "backend_name": "external-systolic",
  "blocked_execution_surfaces": [
    "backend_code_execution",
    "plugin_discovery",
    "dynamic_import",
    "dynamic_library_loading",
    "subprocess_execution",
    "network_access",
    "device_access",
    "generated_artifact_execution",
    "runtime_execution"
  ],
  "capability_manifest_digest": "sha256:7a282b30b775cca5b826019ee1652ce221a85eef6878c7266febc2202293bbf0",
  "case_count": 3,
  "case_results": [
    {
      "case_id": "matmul_row_major_accept",
      "expected_reason": "accepted",
      "expected_supported": true,
      "layout": "row_major",
      "matched": true,
      "observed_reason": "accepted",
      "observed_supported": true,
      "operation_kind": "matmul"
    },
    {
      "case_id": "elementwise_row_major_reject",
      "expected_reason": "unsupported_operation_kind",
      "expected_supported": false,
      "layout": "row_major",
      "matched": true,
      "observed_reason": "unsupported_operation_kind",
      "observed_supported": false,
      "operation_kind": "elementwise"
    },
    {
      "case_id": "matmul_blocked_reject",
      "expected_reason": "unsupported_layout",
      "expected_supported": false,
      "layout": "blocked",
      "matched": true,
      "observed_reason": "unsupported_layout",
      "observed_supported": false,
      "operation_kind": "matmul"
    }
  ],
  "conformance_passed": true,
  "declared_operation_families": [
    "matmul"
  ],
  "device_access": false,
  "execution_permission": false,
  "import_policy": "no_import_or_plugin_discovery",
  "integration_contract": "backend_integration.data_only.v0",
  "integration_status": "PASS",
  "issues": [],
  "memory_domain": "device_sram",
  "network_access": false,
  "package_digest": "sha256:806813974dfde16b46f694566d751b18780d5e43d8455467bf4e5d7ea38b452c",
  "package_id": "external-systolic-reference-package",
  "package_policy": "capability_and_planning_conformance_only",
  "package_version": "0.1.0",
  "planning_probe": {
    "assigned_backend": "external-systolic",
    "assignment_matched": true,
    "graph_name": "backend_integration_package_probe",
    "operation_kind": "matmul",
    "operation_name": "matmul_row_major_accept"
  },
  "plugin_discovery": false,
  "produced_layouts": [
    "blocked"
  ],
  "runtime_execution": false,
  "schema_version": "tuc.backend_integration_package_report.v0",
  "subprocess_execution": false,
  "supported_layouts": [
    "row_major"
  ]
}
